{
  "$schema": "https://json-schema.org/draft/2020-12/schema",
  "$id": "https://papertrader.example/schemas/agent_result.schema.json",
  "title": "PaperTrader completed agent operation result",
  "type": "object",
  "additionalProperties": false,
  "required": [
    "operation_id",
    "status",
    "summary",
    "evidence",
    "files_changed",
    "operations_created",
    "issues_recorded",
    "daily_report_items",
    "commands_run",
    "validation"
  ],
  "properties": {
    "operation_id": { "$ref": "#/$defs/ulid" },
    "status": {
      "type": "string",
      "enum": ["succeeded", "skipped", "blocked", "failed"]
    },
    "summary": { "type": "string", "minLength": 1, "maxLength": 2000 },
    "final_buy_review": { "type": "object" },
    "research_topic": { "type": "object" },
    "research_claims": { "type": "array", "maxItems": 20, "items": { "type": "object" } },
    "adversarial_review": { "type": "object" },
    "monitoring_review": { "type": "object" },
    "catalyst_updates": {"type": "array", "maxItems": 10, "items": {"type": "object"}},
    "research_forecasts": {"type": "array", "maxItems": 5, "items": {"type": "object"}},
    "triage_review": {
      "type": "object",
      "additionalProperties": false,
      "required": ["disposition", "reason", "examined_evidence"],
      "properties": {
        "disposition": {
          "enum": ["no_material_change", "needs_analysis", "duplicate", "defer", "uncertain"]
        },
        "reason": { "type": "string", "minLength": 1, "maxLength": 2000 },
        "examined_evidence": {
          "type": "array", "maxItems": 20, "uniqueItems": true,
          "items": { "type": "string", "minLength": 1, "maxLength": 2000 }
        }
      }
    },
    "reason_code": {
      "type": "string",
      "pattern": "^[a-z][a-z0-9_]{0,127}$"
    },
    "evidence": {
      "type": "array",
      "items": { "$ref": "#/$defs/evidence" },
      "maxItems": 100
    },
    "files_changed": {
      "type": "array",
      "items": { "$ref": "#/$defs/repository_path" },
      "uniqueItems": true
    },
    "operations_created": {
      "type": "array",
      "items": { "$ref": "#/$defs/ulid" },
      "uniqueItems": true
    },
    "issues_recorded": {
      "type": "array",
      "items": { "type": "string", "minLength": 1, "maxLength": 128 },
      "uniqueItems": true
    },
    "daily_report_items": {
      "type": "array",
      "items": { "type": "string", "minLength": 1, "maxLength": 2000 }
    },
    "commands_run": {
      "type": "array",
      "items": { "type": "string", "minLength": 1, "maxLength": 4000 }
    },
    "visualization_review": {
      "type": "object",
      "additionalProperties": false,
      "required": ["completed", "charts", "omissions"],
      "properties": {
        "completed": { "const": true },
        "charts": {
          "type": "array",
          "maxItems": 24,
          "items": {
            "type": "object",
            "additionalProperties": false,
            "required": ["page_path", "chart_id"],
            "properties": {
              "page_path": { "$ref": "#/$defs/repository_path" },
              "chart_id": { "type": "string", "pattern": "^[a-z][a-z0-9-]{0,63}$" }
            }
          }
        },
        "omissions": {
          "type": "array",
          "maxItems": 24,
          "items": {
            "type": "object",
            "additionalProperties": false,
            "required": ["dataset", "reason_code", "reason"],
            "properties": {
              "dataset": { "type": "string", "minLength": 1, "maxLength": 160 },
              "reason_code": {
                "enum": [
                  "single_value",
                  "insufficient_comparability",
                  "insufficient_history",
                  "source_unavailable",
                  "not_decision_relevant",
                  "no_page_change"
                ]
              },
              "reason": { "type": "string", "minLength": 1, "maxLength": 500 }
            }
          }
        }
      }
    },
    "validation": {
      "type": "object",
      "additionalProperties": false,
      "required": ["passed", "checks"],
      "properties": {
        "passed": { "type": "boolean" },
        "checks": {
          "type": "array",
          "items": { "type": "string", "minLength": 1, "maxLength": 1000 }
        }
      }
    }
  },
  "$defs": {
    "ulid": {
      "type": "string",
      "pattern": "^[0-9A-HJKMNP-TV-Z]{26}$"
    },
    "repository_path": {
      "type": "string",
      "minLength": 1,
      "maxLength": 500,
      "pattern": "^(?!/)(?!.*(?:^|/)\\.\\.(?:/|$))[A-Za-z0-9._/-]+$"
    },
    "evidence": {
      "type": "object",
      "additionalProperties": false,
      "required": ["source", "claim"],
      "properties": {
        "source": { "type": "string", "minLength": 1, "maxLength": 1000 },
        "claim": { "type": "string", "minLength": 1, "maxLength": 4000 },
        "url": { "type": "string", "format": "uri", "maxLength": 2000 },
        "observed_at": { "type": "string", "format": "date-time" },
        "source_hash": { "type": "string", "pattern": "^[a-f0-9]{64}$" }
      }
    }
  }
}
