{
  "commands_run": [
    "papertrader order create-baseline --request data/runs/daily-20260910T181020Z/01M268WG401C713HE0TQR365QJ/order-create-baseline-request.json",
    "papertrader portfolio reconcile --strict",
    "papertrader wiki lint --strict"
  ],
  "daily_report_items": [
    "Tencent baseline open: created pending next-open paper order order_b6ce4bf449a70f7985d8 for the deterministic four-share delta toward the current four-share starter target; no fill or accounting entry was created."
  ],
  "evidence": [
    {
      "claim": "The sole current Tencent target binds allocation_plan_4e0ef8323f8d383f6b85 and unchanged allocation_intent_818e8692a59dfaa00cad to strategy_ef910e9aff5203a0b901, assessment_6e8ef7291ff81b77d900, accepted relationship_f625ba3c07d49e1865ff, a four-share target, starter tier, and open disposition.",
      "observed_at": "2026-09-10T18:10:21Z",
      "source": "data/tables/allocation_targets.csv"
    },
    {
      "claim": "Signal signal_993ac82b985a022c3df9 matched the strategy and allocation intent, was live and ready at evaluation, and moved to ordered only after deterministic acceptance.",
      "observed_at": "2026-09-10T18:28:30Z",
      "source": "data/tables/signals.csv"
    },
    {
      "claim": "The identity-matched Tencent market reference was USD 54.689998626708984 and was retrieved at 2026-09-10T18:10:21Z; current Prosus and NVIDIA references were also supplied for deterministic portfolio and pending-exposure risk checks.",
      "observed_at": "2026-09-10T18:10:21Z",
      "source": "data/market/latest.csv"
    },
    {
      "claim": "The current USD-to-EUR risk reference was 0.8607000112533569 and was retrieved at 2026-09-10T18:10:21Z.",
      "observed_at": "2026-09-10T18:10:21Z",
      "source": "data/market/fx/USD_EUR.csv"
    },
    {
      "claim": "Order order_b6ce4bf449a70f7985d8 is pending with next_open fill policy, market order type, allocation_intent_818e8692a59dfaa00cad, and expiry 2026-09-11T18:30:00Z.",
      "observed_at": "2026-09-10T18:28:11Z",
      "source": "data/tables/orders.csv"
    },
    {
      "claim": "Deterministic baseline sizing created one buy/long equity leg for security_de0d83229b369a426b99 with quantity four and contract multiplier one; neither legs nor quantity were supplied in the accepted request.",
      "observed_at": "2026-09-10T18:28:30Z",
      "source": "data/tables/order_legs.csv"
    },
    {
      "claim": "The deterministic baseline-order command exited zero, created order_b6ce4bf449a70f7985d8 with no risk violations, and changed only orders.csv, order_legs.csv, and signals.csv among canonical state; subsequent strict portfolio reconciliation and strict wiki lint both exited zero.",
      "observed_at": "2026-09-10T18:28:44Z",
      "source": "data/runs/daily-20260910T181020Z/01M268WG401C713HE0TQR365QJ/command_audit.json"
    }
  ],
  "files_changed": [
    "data/runs/daily-20260910T181020Z/01M268WG401C713HE0TQR365QJ/order-create-baseline-request.json",
    "data/tables/order_legs.csv",
    "data/tables/orders.csv",
    "data/tables/signals.csv"
  ],
  "issues_recorded": [],
  "operation_id": "01M268WG401C713HE0TQR365QJ",
  "operations_created": [],
  "reason_code": "pending_paper_order_created",
  "status": "succeeded",
  "summary": "Created pending paper order order_b6ce4bf449a70f7985d8 for Tencent's current baseline open signal. Deterministic sizing produced one four-share long-equity buy leg toward the persisted four-share starter target. The order remains pending under next_open; no fill, execution, cash, portfolio, performance, or allocation mutation occurred.",
  "validation": {
    "checks": [
      "Controller preflight identified native llm-wiki 2.1.0, papertrader-controller, and papertrader-execute-strategy with content hashes, sequential execution, and yolo enabled.",
      "The selected queue row was the sole routed running operation, was claimed by daily-20260910T181020Z, and had a live lease at evaluation.",
      "Payload, ready strategy, ready signal, canonical equity leg, current allocation target, immutable assessment, and accepted relationship identities matched before order creation.",
      "The current allocation disposition was open and correctly mapped to the open signal lifecycle action; the current plan and immutable allocation intent were not superseded.",
      "The accepted baseline request omitted legs and quantity; deterministic code derived the exact four-share delta from the persisted four-share target, current holdings, and pending-order state.",
      "Fresh Tencent, Prosus, NVIDIA, and USD/EUR references were supplied; deterministic price, FX, cash, exposure, concentration, turnover, reserve, and baseline eligibility validation accepted the request with no risk violations.",
      "Order idempotency state is canonical: one order exists for signal_993ac82b985a022c3df9, its status is pending, and the signal status is ordered.",
      "Strict portfolio reconciliation returned OK and strict wiki lint returned OK.",
      "The command audit reports no allocation-target/history, execution, cash-ledger, portfolio, or performance changes; the accepted order remains pending and no fill or accounting mutation occurred.",
      "Git diff validation reported no whitespace errors."
    ],
    "passed": true
  }
}
